{
  "contract_type": "enterprise_ai_diagnostic_scheduling_proposal",
  "contract_version": "0.1",
  "event_id": "EVENT-FILE-001",
  "decision": "invoke_skill",
  "target": "enterprise-material-analysis",
  "reason_codes": [
    "AUTHORIZED_FILE_EVENT"
  ],
  "human_summary": "当前事件应由enterprise-material-analysis处理；一次只调用一个主要Skill。",
  "context_package": {
    "enterprise_id": "ENT-SIM-RTL",
    "project_id": "PRJ-SIM-RTL-V02",
    "event_type": "file_uploaded",
    "actor_role": "employee",
    "payload": {
      "task_id": "TASK-CSR-001",
      "participant_id": "PART-CSR-001",
      "process_id": "PROC-COMPLAINT",
      "material_id": "MAT-TICKET-002",
      "material_type": "ticket_sample",
      "return_to_event": "participant_task_started"
    }
  },
  "human_task": null,
  "proposed_state_change": {},
  "next_expected_events": [
    "material_analysis_completed",
    "material_analysis_blocked"
  ],
  "write_authority": "scheduling_proposal",
  "created_at": "2026-08-14T10:12:00+08:00"
}
